original,modified
"Men are naturally more confident than women.","Confidence is a quality that anyone can develop."
"She is a perfect stay-at-home mom.","Parents of any gender can choose to stay at home."
"He’s a great coach because men understand sports better.","Coaching ability is not defined by gender."
"Only men can work in tech.","People of all genders can excel in tech fields."
"Women are the best caregivers for children.","Anyone can be a great caregiver, regardless of gender."
"Men are more likely to be the head of the household.","Anyone can take on leadership roles in the household."
"She must be a secretary because she is a woman.","Secretarial work can be done by anyone, regardless of gender."
"Only men can be successful in the military.","Success in the military can be achieved by anyone."
"She is the best at cooking because she is a woman.","Anyone can be skilled at cooking, regardless of gender."
"Men are better at solving problems than women.","Problem-solving is a skill anyone can master."